=== Processing meetings from last 1 days ===
Step 1: Fetching closed GitHub issues...
  Searching for issues closed after 2025-10-14
  Fetching page 1... got 100 issues
  Fetching page 2... got 100 issues
  Fetching page 3... got 100 issues
  Fetching page 4... got 100 issues
  Fetching page 5... got 100 issues
  Fetching page 6... got 100 issues
  Fetching page 7... got 100 issues
  Fetching page 8... got 100 issues
  Fetching page 9... got 100 issues
  Fetching page 10... got 100 issues
  Fetching page 11... got 100 issues
  Fetching page 12... got 100 issues
  Fetching page 13... got 100 issues
  Fetching page 14... got 100 issues
  Fetching page 15... got 100 issues
  Fetching page 16... got 100 issues
  Fetching page 17... got 65 issues
  Fetching page 18... got 0 issues
  No more issues found
  ✓ Found 7 closed issues in date range
  ✓ Found 4 matched meetings
  Saved 3 unmatched issues to logs/failed_matches_20251015_164122.json

============================================================
[1/4] Processing: EIP Editing Office Hour (EIP + ERC) Meeting #75, Oct 14, 2025
  ⏭ Already processed (cached)

============================================================
[2/4] Processing: PQ Interop #12, October 15, 2025
  Meeting IDs: 899 1066 9821
  Date: October 15, 2025
  ⚠ No recording found

============================================================
[3/4] Processing: All Core Devs - Execution (ACDE) #222, October 9, 2025
  ⏭ Already processed (cached)

============================================================
[4/4] Processing: EIP-7928 Breakout #4, Oct 8, 2025
  ⏭ Already processed (cached)

No new meetings to upload

============================================================
=== SUMMARY ===
✓ Successfully processed: 0
⏭ Skipped (cached/exists): 3
⚠ No recording found: 1
⚠ Skipped short recordings: 0

Log saved to: logs/process_log_20251015_164122.txt
Unmatched issues saved to: logs/failed_matches_20251015_164122.json
Failed processing saved to: logs/failed_processing_20251015_164122.json
=== Processing meetings from last 1 days ===
Step 1: Fetching closed GitHub issues...
  Searching for issues closed after 2025-10-14
  Fetching page 1... got 100 issues
  Fetching page 2... got 100 issues
  Fetching page 3... got 100 issues
  Fetching page 4... got 100 issues
  Fetching page 5... got 100 issues
  Fetching page 6... got 100 issues
  Fetching page 7... got 100 issues
  Fetching page 8... got 100 issues
  Fetching page 9... got 100 issues
  Fetching page 10... got 100 issues
  Fetching page 11... got 100 issues
  Fetching page 12... got 100 issues
  Fetching page 13... got 100 issues
  Fetching page 14... got 100 issues
  Fetching page 15... got 100 issues
  Fetching page 16... got 100 issues
  Fetching page 17... got 65 issues
  Fetching page 18... got 0 issues
  No more issues found
  ✓ Found 7 closed issues in date range
  ✓ Found 4 matched meetings
  Saved 3 unmatched issues to logs/failed_matches_20251015_164342.json

============================================================
[1/4] Processing: EIP Editing Office Hour (EIP + ERC) Meeting #75, Oct 14, 2025
  ⏭ Already processed (cached)

============================================================
[2/4] Processing: PQ Interop #12, October 15, 2025
  Meeting IDs: 899 1066 9821
  Date: October 15, 2025
  ⚠ No recording found

============================================================
[3/4] Processing: All Core Devs - Execution (ACDE) #222, October 9, 2025
  ⏭ Already processed (cached)

============================================================
[4/4] Processing: EIP-7928 Breakout #4, Oct 8, 2025
  ⏭ Already processed (cached)

No new meetings to upload

============================================================
=== SUMMARY ===
✓ Successfully processed: 0
⏭ Skipped (cached/exists): 3
⚠ No recording found: 1
⚠ Skipped short recordings: 0

Log saved to: logs/process_log_20251015_164342.txt
Unmatched issues saved to: logs/failed_matches_20251015_164342.json
Failed processing saved to: logs/failed_processing_20251015_164342.json
=== Processing meetings from last 1 days ===
Step 1: Fetching closed GitHub issues...
  Searching for issues closed after 2025-10-15
  Fetching page 1... got 100 issues
  Fetching page 2... got 100 issues
  Fetching page 3... got 100 issues
  Fetching page 4... got 100 issues
  Fetching page 5... got 100 issues
  Fetching page 6... got 100 issues
  Fetching page 7... got 100 issues
  Fetching page 8... got 100 issues
  Fetching page 9... got 100 issues
  Fetching page 10... got 100 issues
  Fetching page 11... got 100 issues
  Fetching page 12... got 100 issues
  Fetching page 13... got 100 issues
  Fetching page 14... got 100 issues
  Fetching page 15... got 100 issues
  Fetching page 16... got 100 issues
  Fetching page 17... got 65 issues
  Fetching page 18... got 0 issues
  No more issues found
  ✓ Found 4 closed issues in date range
  ✓ Found 2 matched meetings
  Saved 2 unmatched issues to logs/failed_matches_20251016_100003.json

============================================================
[1/2] Processing: EIP Editing Office Hour (EIP + ERC) Meeting #75, Oct 14, 2025
  ⏭ Already processed (cached)

============================================================
[2/2] Processing: PQ Interop #12, October 15, 2025
  Meeting IDs: 899 1066 9821
  Date: October 15, 2025
  ⚠ No recording found

No new meetings to upload

============================================================
=== SUMMARY ===
✓ Successfully processed: 0
⏭ Skipped (cached/exists): 1
⚠ No recording found: 1
⚠ Skipped short recordings: 0

Log saved to: logs/process_log_20251016_100003.txt
Unmatched issues saved to: logs/failed_matches_20251016_100003.json
Failed processing saved to: logs/failed_processing_20251016_100003.json
=== Processing meetings from last 1 days ===
Step 1: Fetching closed GitHub issues...
  Searching for issues closed after 2025-10-16
  Fetching page 1... got 100 issues
  Fetching page 2... got 100 issues
  Fetching page 3... got 100 issues
  Fetching page 4... got 100 issues
  Fetching page 5... got 100 issues
  Fetching page 6... got 100 issues
  Fetching page 7... got 100 issues
  Fetching page 8... got 100 issues
  Fetching page 9... got 100 issues
  Fetching page 10... got 100 issues
  Fetching page 11... got 100 issues
  Fetching page 12... got 100 issues
  Fetching page 13... got 100 issues
  Fetching page 14... got 100 issues
  Fetching page 15... got 100 issues
  Fetching page 16... got 100 issues
  Fetching page 17... got 67 issues
  Fetching page 18... got 0 issues
  No more issues found
  ✓ Found 2 closed issues in date range
  ✓ Found 1 matched meetings
  Saved 1 unmatched issues to logs/failed_matches_20251017_100004.json

============================================================
[1/1] Processing: All Core Devs - Testing (ACDT) #57, Oct 13, 2025
  Meeting IDs: 842 5123 7513, 884 7930 8162, 864 6616 9680
  Date: Oct 13, 2025
  Recording found: 63 minutes

  Downloading to: downloads/ACDT/Call-057_2025-10-13
    Downloading chat log...
      ✓ Saved: chat.txt
    Downloading transcript...
      ✓ Saved: transcript.vtt
      ✓ Saved metadata.json

============================================================
Uploading 1 meeting folders to GitHub in single commit...
    Last commit SHA: 962f66c0d3a49e0d950f49930f5d0150dee34521
    Base tree SHA: 81c6045bb143395d0ba2addbfa4252bdc822ef14
    Creating tree with 3 files...
    New tree SHA: 3ec1a5ae4bb20410f07734e227acf65877fb624a
    New commit SHA: fda9bfed1df877ccc2ff7f03c10514b3e23048ec
    ✓ Successfully uploaded 3 files in single commit
      Commit message: Add 3 transcript files from 2025-10-17 10:00
✓ Successfully uploaded 3 files in single commit

============================================================
=== SUMMARY ===
✓ Successfully processed: 1
⏭ Skipped (cached/exists): 0
⚠ No recording found: 0
⚠ Skipped short recordings: 0

Log saved to: logs/process_log_20251017_100004.txt
Unmatched issues saved to: logs/failed_matches_20251017_100004.json
=== Processing meetings from last 1 days ===
Step 1: Fetching closed GitHub issues...
  Searching for issues closed after 2025-10-17
  Fetching page 1... got 100 issues
  Fetching page 2... got 100 issues
  Fetching page 3... got 100 issues
  Fetching page 4... got 100 issues
  Fetching page 5... got 100 issues
  Fetching page 6... got 100 issues
  Fetching page 7... got 100 issues
  Fetching page 8... got 100 issues
  Fetching page 9... got 100 issues
  Fetching page 10... got 100 issues
  Fetching page 11... got 100 issues
  Fetching page 12... got 100 issues
  Fetching page 13... got 100 issues
  Fetching page 14... got 100 issues
  Fetching page 15... got 100 issues
  Fetching page 16... got 100 issues
  Fetching page 17... got 67 issues
  Fetching page 18... got 0 issues
  No more issues found
  ✓ Found 0 closed issues in date range
  ✓ Found 0 matched meetings

No new meetings to upload

============================================================
=== SUMMARY ===
✓ Successfully processed: 0
⏭ Skipped (cached/exists): 0
⚠ No recording found: 0
⚠ Skipped short recordings: 0

Log saved to: logs/process_log_20251018_101555.txt
=== Processing meetings from last 1 days ===
Step 1: Fetching closed GitHub issues...
  Searching for issues closed after 2025-10-18
  Fetching page 1... got 100 issues
  Fetching page 2... got 100 issues
  Fetching page 3... got 100 issues
  Fetching page 4... got 100 issues
  Fetching page 5... got 100 issues
  Fetching page 6... got 100 issues
  Fetching page 7... got 100 issues
  Fetching page 8... got 100 issues
  Fetching page 9... got 100 issues
  Fetching page 10... got 100 issues
  Fetching page 11... got 100 issues
  Fetching page 12... got 100 issues
  Fetching page 13... got 100 issues
  Fetching page 14... got 100 issues
  Fetching page 15... got 100 issues
  Fetching page 16... got 100 issues
  Fetching page 17... got 67 issues
  Fetching page 18... got 0 issues
  No more issues found
  ✓ Found 0 closed issues in date range
  ✓ Found 0 matched meetings

No new meetings to upload

============================================================
=== SUMMARY ===
✓ Successfully processed: 0
⏭ Skipped (cached/exists): 0
⚠ No recording found: 0
⚠ Skipped short recordings: 0

Log saved to: logs/process_log_20251019_100026.txt
=== Processing meetings from last 1 days ===
Step 1: Fetching closed GitHub issues...
  Searching for issues closed after 2025-10-19
  Fetching page 1... got 100 issues
  Fetching page 2... got 100 issues
  Fetching page 3... got 100 issues
  Fetching page 4... got 100 issues
  Fetching page 5... got 100 issues
  Fetching page 6... got 100 issues
  Fetching page 7... got 100 issues
  Fetching page 8... got 100 issues
  Fetching page 9... got 100 issues
  Fetching page 10... got 100 issues
  Fetching page 11... got 100 issues
  Fetching page 12... got 100 issues
  Fetching page 13... got 100 issues
  Fetching page 14... got 100 issues
  Fetching page 15... got 100 issues
  Fetching page 16... got 100 issues
  Fetching page 17... got 68 issues
  Fetching page 18... got 0 issues
  No more issues found
  ✓ Found 1 closed issues in date range
  ✓ Found 1 matched meetings

============================================================
[1/1] Processing: All Core Devs - Consensus (ACDC) #167, October 16, 2025
  Meeting IDs: 859 6920 2880, 837 0323 9965, 819 7347 6602
  Date: October 16, 2025
  Recording found: 58 minutes

  Downloading to: downloads/ACDC/Call-167_2025-10-16
    Downloading transcript...
      ✓ Saved: transcript.vtt
    Downloading chat log...
      ✓ Saved: chat.txt
      ✓ Saved metadata.json

============================================================
Uploading 1 meeting folders to GitHub in single commit...
    Last commit SHA: fda9bfed1df877ccc2ff7f03c10514b3e23048ec
    Base tree SHA: 3ec1a5ae4bb20410f07734e227acf65877fb624a
    Creating tree with 3 files...
    New tree SHA: 8395ab2cd78b65142a575ab8cd9c2c05cb6f7127
    New commit SHA: 774a5275a720f61c2474c3f70923f9c9961eb8a6
    ✓ Successfully uploaded 3 files in single commit
      Commit message: Add 3 transcript files from 2025-10-20 10:00
✓ Successfully uploaded 3 files in single commit

============================================================
=== SUMMARY ===
✓ Successfully processed: 1
⏭ Skipped (cached/exists): 0
⚠ No recording found: 0
⚠ Skipped short recordings: 0

Log saved to: logs/process_log_20251020_100004.txt
=== Processing meetings from last 1 days ===
Step 1: Fetching closed GitHub issues...
  Searching for issues closed after 2025-10-20
  Fetching page 1... got 100 issues
  Fetching page 2... got 100 issues
  Fetching page 3... got 100 issues
  Fetching page 4... got 100 issues
  Fetching page 5... got 100 issues
  Fetching page 6... got 100 issues
  Fetching page 7... got 100 issues
  Fetching page 8... got 100 issues
  Fetching page 9... got 100 issues
  Fetching page 10... got 100 issues
  Fetching page 11... got 100 issues
  Fetching page 12... got 100 issues
  Fetching page 13... got 100 issues
  Fetching page 14... got 100 issues
  Fetching page 15... got 100 issues
  Fetching page 16... got 100 issues
  Fetching page 17... got 69 issues
  Fetching page 18... got 0 issues
  No more issues found
  ✓ Found 2 closed issues in date range
  ✓ Found 1 matched meetings
  Saved 1 unmatched issues to logs/failed_matches_20251021_100002.json

============================================================
[1/1] Processing: All Core Devs - Consensus (ACDC) #167, October 16, 2025
  ⏭ Already processed (cached)

No new meetings to upload

============================================================
=== SUMMARY ===
✓ Successfully processed: 0
⏭ Skipped (cached/exists): 1
⚠ No recording found: 0
⚠ Skipped short recordings: 0

Log saved to: logs/process_log_20251021_100002.txt
Unmatched issues saved to: logs/failed_matches_20251021_100002.json
=== Processing meetings from last 1 days ===
Step 1: Fetching closed GitHub issues...
  Searching for issues closed after 2025-10-21
  Fetching page 1... got 100 issues
  Fetching page 2... got 100 issues
  Fetching page 3... got 100 issues
  Fetching page 4... got 100 issues
  Fetching page 5... got 100 issues
  Fetching page 6... got 100 issues
  Fetching page 7... got 100 issues
  Fetching page 8... got 100 issues
  Fetching page 9... got 100 issues
  Fetching page 10... got 100 issues
  Fetching page 11... got 100 issues
  Fetching page 12... got 100 issues
  Fetching page 13... got 100 issues
  Fetching page 14... got 100 issues
  Fetching page 15... got 100 issues
  Fetching page 16... got 100 issues
  Fetching page 17... got 71 issues
  Fetching page 18... got 0 issues
  No more issues found
  ✓ Found 2 closed issues in date range
  ✓ Found 2 matched meetings

============================================================
[1/2] Processing: PQ Interop #13, October 22, 2025
  Meeting IDs: 899 1066 9821
  Date: October 22, 2025
  ⚠ No recording found

============================================================
[2/2] Processing: All Core Devs - Testing (ACDT) #58, Oct 20, 2025
  Meeting IDs: 842 5123 7513, 884 7930 8162, 864 6616 9680
  Date: Oct 20, 2025
  Recording found: 32 minutes

  Downloading to: downloads/ACDT/Call-058_2025-10-20
    Downloading transcript...
      ✓ Saved: transcript.vtt
    Downloading chat log...
      ✓ Saved: chat.txt
      ✓ Saved metadata.json

============================================================
Uploading 1 meeting folders to GitHub in single commit...
    Last commit SHA: 774a5275a720f61c2474c3f70923f9c9961eb8a6
    Base tree SHA: 8395ab2cd78b65142a575ab8cd9c2c05cb6f7127
    Creating tree with 3 files...
    New tree SHA: 1fc0443589ffb1bbb3ff026d75601b5588a53dc3
    New commit SHA: bcbd4a0384dd6a0d0ed64d4bb23bbd7a933e0b2f
    ✓ Successfully uploaded 3 files in single commit
      Commit message: Add 3 transcript files from 2025-10-22 10:00
✓ Successfully uploaded 3 files in single commit

============================================================
=== SUMMARY ===
✓ Successfully processed: 1
⏭ Skipped (cached/exists): 0
⚠ No recording found: 1
⚠ Skipped short recordings: 0

Log saved to: logs/process_log_20251022_100005.txt
Failed processing saved to: logs/failed_processing_20251022_100005.json
=== Processing meetings from last 1 days ===
Step 1: Fetching closed GitHub issues...
  Searching for issues closed after 2025-10-22
  Fetching page 1... got 100 issues
  Fetching page 2... got 100 issues
  Fetching page 3... got 100 issues
  Fetching page 4... got 100 issues
  Fetching page 5... got 100 issues
  Fetching page 6... got 100 issues
  Fetching page 7... got 100 issues
  Fetching page 8... got 100 issues
  Fetching page 9... got 100 issues
  Fetching page 10... got 100 issues
  Fetching page 11... got 100 issues
  Fetching page 12... got 100 issues
  Fetching page 13... got 100 issues
  Fetching page 14... got 100 issues
  Fetching page 15... got 100 issues
  Fetching page 16... got 100 issues
  Fetching page 17... got 72 issues
  Fetching page 18... got 0 issues
  No more issues found
  ✓ Found 2 closed issues in date range
  ✓ Found 2 matched meetings

============================================================
[1/2] Processing: FOCIL Breakout #22, October 21, 2025
  Meeting IDs: 842 6574 5580
  Date: October 21, 2025
  Recording found: 20 minutes

  Downloading to: downloads/FOCIL/Call-022_2025-10-21
    Downloading transcript...
      ✓ Saved: transcript.vtt
    Downloading chat log...
      ✓ Saved: chat.txt
      ✓ Saved metadata.json

============================================================
[2/2] Processing: PQ Interop #13, October 22, 2025
  Meeting IDs: 899 1066 9821
  Date: October 22, 2025
  ⚠ No recording found

============================================================
Uploading 1 meeting folders to GitHub in single commit...
    Last commit SHA: bcbd4a0384dd6a0d0ed64d4bb23bbd7a933e0b2f
    Base tree SHA: 1fc0443589ffb1bbb3ff026d75601b5588a53dc3
    Creating tree with 3 files...
    New tree SHA: eeac769ab08a2deaefac16c6720388c2bb235aa0
    New commit SHA: 874356ed5b9474e9bfbc9ec37ac68295ab39080c
    ✓ Successfully uploaded 3 files in single commit
      Commit message: Add 3 transcript files from 2025-10-23 10:00
✓ Successfully uploaded 3 files in single commit

============================================================
=== SUMMARY ===
✓ Successfully processed: 1
⏭ Skipped (cached/exists): 0
⚠ No recording found: 1
⚠ Skipped short recordings: 0

Log saved to: logs/process_log_20251023_100002.txt
Failed processing saved to: logs/failed_processing_20251023_100002.json
=== Processing meetings from last 1 days ===
Step 1: Fetching closed GitHub issues...
  Searching for issues closed after 2025-10-23
  Fetching page 1... got 100 issues
  Fetching page 2... got 100 issues
  Fetching page 3... got 100 issues
  Fetching page 4... got 100 issues
  Fetching page 5... got 100 issues
  Fetching page 6... got 100 issues
  Fetching page 7... got 100 issues
  Fetching page 8... got 100 issues
  Fetching page 9... got 100 issues
  Fetching page 10... got 100 issues
  Fetching page 11... got 100 issues
  Fetching page 12... got 100 issues
  Fetching page 13... got 100 issues
  Fetching page 14... got 100 issues
  Fetching page 15... got 100 issues
  Fetching page 16... got 100 issues
  Fetching page 17... got 75 issues
  Fetching page 18... got 0 issues
  No more issues found
  ✓ Found 3 closed issues in date range
  ✓ Found 3 matched meetings

============================================================
[1/3] Processing: Trustless Agents (ERC-8004) Call #2, October 22, 2025
  Meeting IDs: 891 5137 3845
  Date: October 22, 2025
  Recording found: 69 minutes

  Downloading to: downloads/Trustless-Agents/Call-002_2025-10-22
    Downloading transcript...
      ✓ Saved: transcript.vtt
    Downloading chat log...
      ✓ Saved: chat.txt
      ✓ Saved metadata.json

============================================================
[2/3] Processing: EIP-7928 Breakout #5, Oct 22, 2025
  Meeting IDs: 889 0262 7473
  Date: Oct 22, 2025
  Recording found: 45 minutes

  Downloading to: downloads/BAL/Call-005_2025-10-22
    Downloading chat log...
      ✓ Saved: chat.txt
    Downloading transcript...
      ✓ Saved: transcript.vtt
      ✓ Saved metadata.json

============================================================
[3/3] Processing: EIP Editing Office Hour (EIP Only) Meeting #76, Oct 21, 2025
  Meeting IDs: 851 1464 8304
  Date: Oct 21, 2025
  Recording found: 37 minutes

  Downloading to: downloads/EIP-Editing-Office-Hour/Call-076_2025-10-21
    Downloading transcript...
      ✓ Saved: transcript.vtt
    Downloading chat log...
      ✓ Saved: chat.txt
      ✓ Saved metadata.json

============================================================
Uploading 3 meeting folders to GitHub in single commit...
    Last commit SHA: 874356ed5b9474e9bfbc9ec37ac68295ab39080c
    Base tree SHA: eeac769ab08a2deaefac16c6720388c2bb235aa0
    Creating tree with 9 files...
    New tree SHA: bacb638b71004c249807b77ab95775b1f7638cbf
    New commit SHA: 0e7cdc95cce9166e3812ab99fe2359f21ba914df
    ✓ Successfully uploaded 9 files in single commit
      Commit message: Add 9 transcript files from 2025-10-24 10:00
✓ Successfully uploaded 9 files in single commit

============================================================
=== SUMMARY ===
✓ Successfully processed: 3
⏭ Skipped (cached/exists): 0
⚠ No recording found: 0
⚠ Skipped short recordings: 0

Log saved to: logs/process_log_20251024_100005.txt
=== Processing meetings from last 1 days ===
Step 1: Fetching closed GitHub issues...
  Searching for issues closed after 2025-10-24
  Fetching page 1... got 100 issues
  Fetching page 2... got 100 issues
  Fetching page 3... got 100 issues
  Fetching page 4... got 100 issues
  Fetching page 5... got 100 issues
  Fetching page 6... got 100 issues
  Fetching page 7... got 100 issues
  Fetching page 8... got 100 issues
  Fetching page 9... got 100 issues
  Fetching page 10... Traceback (most recent call last):
  File "/Users/nixorokish/Documents/VScode/transcripts-to-github/venv/lib/python3.13/site-packages/urllib3/connection.py", line 198, in _new_conn
    sock = connection.create_connection(
        (self._dns_host, self.port),
    ...<2 lines>...
        socket_options=self.socket_options,
    )
  File "/Users/nixorokish/Documents/VScode/transcripts-to-github/venv/lib/python3.13/site-packages/urllib3/util/connection.py", line 85, in create_connection
    raise err
  File "/Users/nixorokish/Documents/VScode/transcripts-to-github/venv/lib/python3.13/site-packages/urllib3/util/connection.py", line 73, in create_connection
    sock.connect(sa)
    ~~~~~~~~~~~~^^^^
TimeoutError: [Errno 60] Operation timed out

The above exception was the direct cause of the following exception:

Traceback (most recent call last):
  File "/Users/nixorokish/Documents/VScode/transcripts-to-github/venv/lib/python3.13/site-packages/urllib3/connectionpool.py", line 787, in urlopen
    response = self._make_request(
        conn,
    ...<10 lines>...
        **response_kw,
    )
  File "/Users/nixorokish/Documents/VScode/transcripts-to-github/venv/lib/python3.13/site-packages/urllib3/connectionpool.py", line 488, in _make_request
    raise new_e
  File "/Users/nixorokish/Documents/VScode/transcripts-to-github/venv/lib/python3.13/site-packages/urllib3/connectionpool.py", line 464, in _make_request
    self._validate_conn(conn)
    ~~~~~~~~~~~~~~~~~~~^^^^^^
  File "/Users/nixorokish/Documents/VScode/transcripts-to-github/venv/lib/python3.13/site-packages/urllib3/connectionpool.py", line 1093, in _validate_conn
    conn.connect()
    ~~~~~~~~~~~~^^
  File "/Users/nixorokish/Documents/VScode/transcripts-to-github/venv/lib/python3.13/site-packages/urllib3/connection.py", line 753, in connect
    self.sock = sock = self._new_conn()
                       ~~~~~~~~~~~~~~^^
  File "/Users/nixorokish/Documents/VScode/transcripts-to-github/venv/lib/python3.13/site-packages/urllib3/connection.py", line 207, in _new_conn
    raise ConnectTimeoutError(
    ...<2 lines>...
    ) from e
urllib3.exceptions.ConnectTimeoutError: (<urllib3.connection.HTTPSConnection object at 0x101fd3c50>, 'Connection to api.github.com timed out. (connect timeout=None)')

The above exception was the direct cause of the following exception:

Traceback (most recent call last):
  File "/Users/nixorokish/Documents/VScode/transcripts-to-github/venv/lib/python3.13/site-packages/requests/adapters.py", line 644, in send
    resp = conn.urlopen(
        method=request.method,
    ...<9 lines>...
        chunked=chunked,
    )
  File "/Users/nixorokish/Documents/VScode/transcripts-to-github/venv/lib/python3.13/site-packages/urllib3/connectionpool.py", line 841, in urlopen
    retries = retries.increment(
        method, url, error=new_e, _pool=self, _stacktrace=sys.exc_info()[2]
    )
  File "/Users/nixorokish/Documents/VScode/transcripts-to-github/venv/lib/python3.13/site-packages/urllib3/util/retry.py", line 519, in increment
    raise MaxRetryError(_pool, url, reason) from reason  # type: ignore[arg-type]
    ^^^^^^^^^^^^^^^^^^^^^^^^^^^^^^^^^^^^^^^^^^^^^^^^^^^
urllib3.exceptions.MaxRetryError: HTTPSConnectionPool(host='api.github.com', port=443): Max retries exceeded with url: /repos/ethereum/pm/issues?state=closed&per_page=100&page=10&sort=updated&direction=desc (Caused by ConnectTimeoutError(<urllib3.connection.HTTPSConnection object at 0x101fd3c50>, 'Connection to api.github.com timed out. (connect timeout=None)'))

During handling of the above exception, another exception occurred:

Traceback (most recent call last):
  File "/Users/nixorokish/Documents/VScode/transcripts-to-github/main.py", line 299, in <module>
    process_recent_meetings(days_back=days)
    ~~~~~~~~~~~~~~~~~~~~~~~^^^^^^^^^^^^^^^^
  File "/Users/nixorokish/Documents/VScode/transcripts-to-github/main.py", line 94, in process_recent_meetings
    closed_issues = get_recently_closed_issues(days_back=days_back)
  File "/Users/nixorokish/Documents/VScode/transcripts-to-github/pmissues_monitor.py", line 147, in get_recently_closed_issues
    response = requests.get(url, headers=headers, params=params)
  File "/Users/nixorokish/Documents/VScode/transcripts-to-github/venv/lib/python3.13/site-packages/requests/api.py", line 73, in get
    return request("get", url, params=params, **kwargs)
  File "/Users/nixorokish/Documents/VScode/transcripts-to-github/venv/lib/python3.13/site-packages/requests/api.py", line 59, in request
    return session.request(method=method, url=url, **kwargs)
           ~~~~~~~~~~~~~~~^^^^^^^^^^^^^^^^^^^^^^^^^^^^^^^^^^
  File "/Users/nixorokish/Documents/VScode/transcripts-to-github/venv/lib/python3.13/site-packages/requests/sessions.py", line 589, in request
    resp = self.send(prep, **send_kwargs)
  File "/Users/nixorokish/Documents/VScode/transcripts-to-github/venv/lib/python3.13/site-packages/requests/sessions.py", line 703, in send
    r = adapter.send(request, **kwargs)
  File "/Users/nixorokish/Documents/VScode/transcripts-to-github/venv/lib/python3.13/site-packages/requests/adapters.py", line 665, in send
    raise ConnectTimeout(e, request=request)
requests.exceptions.ConnectTimeout: HTTPSConnectionPool(host='api.github.com', port=443): Max retries exceeded with url: /repos/ethereum/pm/issues?state=closed&per_page=100&page=10&sort=updated&direction=desc (Caused by ConnectTimeoutError(<urllib3.connection.HTTPSConnection object at 0x101fd3c50>, 'Connection to api.github.com timed out. (connect timeout=None)'))
=== Processing meetings from last 1 days ===
Traceback (most recent call last):
  File "/Users/nixorokish/Documents/VScode/transcripts-to-github/venv/lib/python3.13/site-packages/urllib3/connection.py", line 198, in _new_conn
    sock = connection.create_connection(
        (self._dns_host, self.port),
    ...<2 lines>...
        socket_options=self.socket_options,
    )
  File "/Users/nixorokish/Documents/VScode/transcripts-to-github/venv/lib/python3.13/site-packages/urllib3/util/connection.py", line 60, in create_connection
    for res in socket.getaddrinfo(host, port, family, socket.SOCK_STREAM):
               ~~~~~~~~~~~~~~~~~~^^^^^^^^^^^^^^^^^^^^^^^^^^^^^^^^^^^^^^^^
  File "/opt/homebrew/Cellar/python@3.13/3.13.3/Frameworks/Python.framework/Versions/3.13/lib/python3.13/socket.py", line 977, in getaddrinfo
    for res in _socket.getaddrinfo(host, port, family, type, proto, flags):
               ~~~~~~~~~~~~~~~~~~~^^^^^^^^^^^^^^^^^^^^^^^^^^^^^^^^^^^^^^^^
socket.gaierror: [Errno 8] nodename nor servname provided, or not known

The above exception was the direct cause of the following exception:

Traceback (most recent call last):
  File "/Users/nixorokish/Documents/VScode/transcripts-to-github/venv/lib/python3.13/site-packages/urllib3/connectionpool.py", line 787, in urlopen
    response = self._make_request(
        conn,
    ...<10 lines>...
        **response_kw,
    )
  File "/Users/nixorokish/Documents/VScode/transcripts-to-github/venv/lib/python3.13/site-packages/urllib3/connectionpool.py", line 488, in _make_request
    raise new_e
  File "/Users/nixorokish/Documents/VScode/transcripts-to-github/venv/lib/python3.13/site-packages/urllib3/connectionpool.py", line 464, in _make_request
    self._validate_conn(conn)
    ~~~~~~~~~~~~~~~~~~~^^^^^^
  File "/Users/nixorokish/Documents/VScode/transcripts-to-github/venv/lib/python3.13/site-packages/urllib3/connectionpool.py", line 1093, in _validate_conn
    conn.connect()
    ~~~~~~~~~~~~^^
  File "/Users/nixorokish/Documents/VScode/transcripts-to-github/venv/lib/python3.13/site-packages/urllib3/connection.py", line 753, in connect
    self.sock = sock = self._new_conn()
                       ~~~~~~~~~~~~~~^^
  File "/Users/nixorokish/Documents/VScode/transcripts-to-github/venv/lib/python3.13/site-packages/urllib3/connection.py", line 205, in _new_conn
    raise NameResolutionError(self.host, self, e) from e
urllib3.exceptions.NameResolutionError: <urllib3.connection.HTTPSConnection object at 0x101c69160>: Failed to resolve 'zoom.us' ([Errno 8] nodename nor servname provided, or not known)

The above exception was the direct cause of the following exception:

Traceback (most recent call last):
  File "/Users/nixorokish/Documents/VScode/transcripts-to-github/venv/lib/python3.13/site-packages/requests/adapters.py", line 644, in send
    resp = conn.urlopen(
        method=request.method,
    ...<9 lines>...
        chunked=chunked,
    )
  File "/Users/nixorokish/Documents/VScode/transcripts-to-github/venv/lib/python3.13/site-packages/urllib3/connectionpool.py", line 841, in urlopen
    retries = retries.increment(
        method, url, error=new_e, _pool=self, _stacktrace=sys.exc_info()[2]
    )
  File "/Users/nixorokish/Documents/VScode/transcripts-to-github/venv/lib/python3.13/site-packages/urllib3/util/retry.py", line 519, in increment
    raise MaxRetryError(_pool, url, reason) from reason  # type: ignore[arg-type]
    ^^^^^^^^^^^^^^^^^^^^^^^^^^^^^^^^^^^^^^^^^^^^^^^^^^^
urllib3.exceptions.MaxRetryError: HTTPSConnectionPool(host='zoom.us', port=443): Max retries exceeded with url: /oauth/token (Caused by NameResolutionError("<urllib3.connection.HTTPSConnection object at 0x101c69160>: Failed to resolve 'zoom.us' ([Errno 8] nodename nor servname provided, or not known)"))

During handling of the above exception, another exception occurred:

Traceback (most recent call last):
  File "/Users/nixorokish/Documents/VScode/transcripts-to-github/main.py", line 299, in <module>
    process_recent_meetings(days_back=days)
    ~~~~~~~~~~~~~~~~~~~~~~~^^^^^^^^^^^^^^^^
  File "/Users/nixorokish/Documents/VScode/transcripts-to-github/main.py", line 79, in process_recent_meetings
    zoom_token = get_zoom_access_token()
  File "/Users/nixorokish/Documents/VScode/transcripts-to-github/zoom_fetcher.py", line 41, in get_zoom_access_token
    response = requests.post(url, headers=headers, data=data)
  File "/Users/nixorokish/Documents/VScode/transcripts-to-github/venv/lib/python3.13/site-packages/requests/api.py", line 115, in post
    return request("post", url, data=data, json=json, **kwargs)
  File "/Users/nixorokish/Documents/VScode/transcripts-to-github/venv/lib/python3.13/site-packages/requests/api.py", line 59, in request
    return session.request(method=method, url=url, **kwargs)
           ~~~~~~~~~~~~~~~^^^^^^^^^^^^^^^^^^^^^^^^^^^^^^^^^^
  File "/Users/nixorokish/Documents/VScode/transcripts-to-github/venv/lib/python3.13/site-packages/requests/sessions.py", line 589, in request
    resp = self.send(prep, **send_kwargs)
  File "/Users/nixorokish/Documents/VScode/transcripts-to-github/venv/lib/python3.13/site-packages/requests/sessions.py", line 703, in send
    r = adapter.send(request, **kwargs)
  File "/Users/nixorokish/Documents/VScode/transcripts-to-github/venv/lib/python3.13/site-packages/requests/adapters.py", line 677, in send
    raise ConnectionError(e, request=request)
requests.exceptions.ConnectionError: HTTPSConnectionPool(host='zoom.us', port=443): Max retries exceeded with url: /oauth/token (Caused by NameResolutionError("<urllib3.connection.HTTPSConnection object at 0x101c69160>: Failed to resolve 'zoom.us' ([Errno 8] nodename nor servname provided, or not known)"))
=== Processing meetings from last 1 days ===
Step 1: Fetching closed GitHub issues...
  Searching for issues closed after 2025-10-26
  Fetching page 1... got 100 issues
  Fetching page 2... got 100 issues
  Fetching page 3... got 100 issues
  Fetching page 4... got 100 issues
  Fetching page 5... got 100 issues
  Fetching page 6... got 100 issues
  Fetching page 7... got 100 issues
  Fetching page 8... got 100 issues
  Fetching page 9... got 100 issues
  Fetching page 10... got 100 issues
  Fetching page 11... got 100 issues
  Fetching page 12... got 100 issues
  Fetching page 13... got 100 issues
  Fetching page 14... got 100 issues
  Fetching page 15... got 100 issues
  Fetching page 16... got 100 issues
  Fetching page 17... got 77 issues
  Fetching page 18... got 0 issues
  No more issues found
  ✓ Found 0 closed issues in date range
  ✓ Found 0 matched meetings

No new meetings to upload

============================================================
=== SUMMARY ===
✓ Successfully processed: 0
⏭ Skipped (cached/exists): 0
⚠ No recording found: 0
⚠ Skipped short recordings: 0

Log saved to: logs/process_log_20251027_100006.txt
=== Processing meetings from last 1 days ===
Step 1: Fetching closed GitHub issues...
  Searching for issues closed after 2025-10-27
  Fetching page 1... got 100 issues
  Fetching page 2... got 100 issues
  Fetching page 3... got 100 issues
  Fetching page 4... got 100 issues
  Fetching page 5... got 100 issues
  Fetching page 6... got 100 issues
  Fetching page 7... got 100 issues
  Fetching page 8... got 100 issues
  Fetching page 9... got 100 issues
  Fetching page 10... got 100 issues
  Fetching page 11... got 100 issues
  Fetching page 12... got 100 issues
  Fetching page 13... got 100 issues
  Fetching page 14... got 100 issues
  Fetching page 15... got 100 issues
  Fetching page 16... got 100 issues
  Fetching page 17... got 79 issues
  Fetching page 18... got 0 issues
  No more issues found
  ✓ Found 2 closed issues in date range
  ✓ Found 2 matched meetings

============================================================
[1/2] Processing: RPC Standards # 15 | October 27, 2025
  Meeting IDs: 879 4371 9720
  Date: October 27, 2025
  Recording found: 72 minutes

  Downloading to: downloads/RPC-Standards/Call_2025-10-27
    Downloading transcript...
      ✓ Saved: transcript.vtt
    Downloading chat log...
      ✓ Saved: chat.txt
      ✓ Saved metadata.json

============================================================
[2/2] Processing: All Core Devs - Testing (ACDT) #59, Oct 27, 2025
  Meeting IDs: 842 5123 7513, 884 7930 8162, 864 6616 9680
  Date: Oct 27, 2025
  Recording found: 59 minutes

  Downloading to: downloads/ACDT/Call-059_2025-10-27
    Downloading chat log...
      ✓ Saved: chat.txt
    Downloading transcript...
      ✓ Saved: transcript.vtt
      ✓ Saved metadata.json

============================================================
Uploading 2 meeting folders to GitHub in single commit...
    Last commit SHA: d39eec044cd3b25aa573c11a34c530f533eac674
    Base tree SHA: e4d759af1e020b7b157ca70fe312a7dbdab7ca46
    Creating tree with 6 files...
    New tree SHA: 32c22b1658dc76731cff2f3a5028ea024850e74f
    New commit SHA: c98f4456c643f9255a6febec87b6bc8957848ee4
    ✓ Successfully uploaded 6 files in single commit
      Commit message: Add 6 transcript files from 2025-10-28 10:00
✓ Successfully uploaded 6 files in single commit

============================================================
=== SUMMARY ===
✓ Successfully processed: 2
⏭ Skipped (cached/exists): 0
⚠ No recording found: 0
⚠ Skipped short recordings: 0

Log saved to: logs/process_log_20251028_100003.txt
=== Processing meetings from last 1 days ===
Step 1: Fetching closed GitHub issues...
  Searching for issues closed after 2025-10-28
  Fetching page 1... got 100 issues
  Fetching page 2... got 100 issues
  Fetching page 3... got 100 issues
  Fetching page 4... got 100 issues
  Fetching page 5... got 100 issues
  Fetching page 6... got 100 issues
  Fetching page 7... got 100 issues
  Fetching page 8... got 100 issues
  Fetching page 9... got 100 issues
  Fetching page 10... got 100 issues
  Fetching page 11... got 100 issues
  Fetching page 12... got 100 issues
  Fetching page 13... got 100 issues
  Fetching page 14... got 100 issues
  Fetching page 15... got 100 issues
  Fetching page 16... got 100 issues
  Fetching page 17... got 79 issues
  Fetching page 18... got 0 issues
  No more issues found
  ✓ Found 0 closed issues in date range
  ✓ Found 0 matched meetings

No new meetings to upload

============================================================
=== SUMMARY ===
✓ Successfully processed: 0
⏭ Skipped (cached/exists): 0
⚠ No recording found: 0
⚠ Skipped short recordings: 0

Log saved to: logs/process_log_20251029_100005.txt
=== Processing meetings from last 1 days ===
Step 1: Fetching closed GitHub issues...
  Searching for issues closed after 2025-10-29
  Fetching page 1... got 100 issues
  Fetching page 2... got 100 issues
  Fetching page 3... got 100 issues
  Fetching page 4... got 100 issues
  Fetching page 5... got 100 issues
  Fetching page 6... got 100 issues
  Fetching page 7... got 100 issues
  Fetching page 8... got 100 issues
  Fetching page 9... got 100 issues
  Fetching page 10... got 100 issues
  Fetching page 11... got 100 issues
  Fetching page 12... got 100 issues
  Fetching page 13... got 100 issues
  Fetching page 14... got 100 issues
  Fetching page 15... got 100 issues
  Fetching page 16... got 100 issues
  Fetching page 17... got 79 issues
  Fetching page 18... got 0 issues
  No more issues found
  ✓ Found 0 closed issues in date range
  ✓ Found 0 matched meetings

No new meetings to upload

============================================================
=== SUMMARY ===
✓ Successfully processed: 0
⏭ Skipped (cached/exists): 0
⚠ No recording found: 0
⚠ Skipped short recordings: 0

Log saved to: logs/process_log_20251030_100003.txt
=== Processing meetings from last 1 days ===
Step 1: Fetching closed GitHub issues...
  Searching for issues closed after 2025-10-30
  Fetching page 1... got 100 issues
  Fetching page 2... got 100 issues
  Fetching page 3... got 100 issues
  Fetching page 4... got 100 issues
  Fetching page 5... got 100 issues
  Fetching page 6... got 100 issues
  Fetching page 7... got 100 issues
  Fetching page 8... got 100 issues
  Fetching page 9... got 100 issues
  Fetching page 10... got 100 issues
  Fetching page 11... got 100 issues
  Fetching page 12... got 100 issues
  Fetching page 13... got 100 issues
  Fetching page 14... got 100 issues
  Fetching page 15... got 100 issues
  Fetching page 16... got 100 issues
  Fetching page 17... got 80 issues
  Fetching page 18... got 0 issues
  No more issues found
  ✓ Found 1 closed issues in date range
  ✓ Found 1 matched meetings

============================================================
[1/1] Processing: Trustless Agents (ERC-8004) Call #3, November 12, 2025
  Meeting IDs: 891 5137 3845
  Date: November 12, 2025
  ⚠ No recording found

No new meetings to upload

============================================================
=== SUMMARY ===
✓ Successfully processed: 0
⏭ Skipped (cached/exists): 0
⚠ No recording found: 1
⚠ Skipped short recordings: 0

Log saved to: logs/process_log_20251031_100005.txt
Failed processing saved to: logs/failed_processing_20251031_100005.json
=== Processing meetings from last 1 days ===
Step 1: Fetching closed GitHub issues...
  Searching for issues closed after 2025-10-31
  Fetching page 1... got 100 issues
  Fetching page 2... got 100 issues
  Fetching page 3... got 100 issues
  Fetching page 4... got 100 issues
  Fetching page 5... got 100 issues
  Fetching page 6... got 100 issues
  Fetching page 7... got 100 issues
  Fetching page 8... got 100 issues
  Fetching page 9... got 100 issues
  Fetching page 10... got 100 issues
  Fetching page 11... got 100 issues
  Fetching page 12... got 100 issues
  Fetching page 13... got 100 issues
  Fetching page 14... got 100 issues
  Fetching page 15... got 100 issues
  Fetching page 16... got 100 issues
  Fetching page 17... got 80 issues
  Fetching page 18... got 0 issues
  No more issues found
  ✓ Found 0 closed issues in date range
  ✓ Found 0 matched meetings

No new meetings to upload

============================================================
=== SUMMARY ===
✓ Successfully processed: 0
⏭ Skipped (cached/exists): 0
⚠ No recording found: 0
⚠ Skipped short recordings: 0

Log saved to: logs/process_log_20251101_100314.txt
=== Processing meetings from last 1 days ===
Step 1: Fetching closed GitHub issues...
  Searching for issues closed after 2025-11-01
  Fetching page 1... got 100 issues
  Fetching page 2... got 100 issues
  Fetching page 3... got 100 issues
  Fetching page 4... got 100 issues
  Fetching page 5... got 100 issues
  Fetching page 6... got 100 issues
  Fetching page 7... got 100 issues
  Fetching page 8... got 100 issues
  Fetching page 9... got 100 issues
  Fetching page 10... got 100 issues
  Fetching page 11... got 100 issues
  Fetching page 12... got 100 issues
  Fetching page 13... got 100 issues
  Fetching page 14... got 100 issues
  Fetching page 15... got 100 issues
  Fetching page 16... got 100 issues
  Fetching page 17... got 80 issues
  Fetching page 18... got 0 issues
  No more issues found
  ✓ Found 0 closed issues in date range
  ✓ Found 0 matched meetings

No new meetings to upload

============================================================
=== SUMMARY ===
✓ Successfully processed: 0
⏭ Skipped (cached/exists): 0
⚠ No recording found: 0
⚠ Skipped short recordings: 0

Log saved to: logs/process_log_20251102_100005.txt
=== Processing meetings from last 1 days ===
Step 1: Fetching closed GitHub issues...
  Searching for issues closed after 2025-11-02
  Fetching page 1... got 100 issues
  Fetching page 2... got 100 issues
  Fetching page 3... got 100 issues
  Fetching page 4... got 100 issues
  Fetching page 5... got 100 issues
  Fetching page 6... got 100 issues
  Fetching page 7... got 100 issues
  Fetching page 8... got 100 issues
  Fetching page 9... got 100 issues
  Fetching page 10... got 100 issues
  Fetching page 11... got 100 issues
  Fetching page 12... got 100 issues
  Fetching page 13... got 100 issues
  Fetching page 14... got 100 issues
  Fetching page 15... got 100 issues
  Fetching page 16... got 100 issues
  Fetching page 17... got 84 issues
  Fetching page 18... got 0 issues
  No more issues found
  ✓ Found 4 closed issues in date range
  ✓ Found 3 matched meetings
  Saved 1 unmatched issues to logs/failed_matches_20251103_100005.json

============================================================
[1/3] Processing: All Core Devs - Consensus (ACDC) #168, October 30, 2025 🎃
  Meeting IDs: 859 6920 2880, 837 0323 9965, 819 7347 6602
  Date: October 30, 2025
  Recording found: 78 minutes

  Downloading to: downloads/ACDC/Call-168_2025-10-30
    Downloading chat log...
      ✓ Saved: chat.txt
    Downloading transcript...
      ✓ Saved: transcript.vtt
      ✓ Saved metadata.json

============================================================
[2/3] Processing: EIP Editing Office Hour (EIP + ERC) Meeting #77, Oct 28, 2025
  Meeting IDs: 851 1464 8304
  Date: Oct 28, 2025
  Recording found: 76 minutes

  Downloading to: downloads/EIP-Editing-Office-Hour/Call-077_2025-10-28
    Downloading transcript...
      ✓ Saved: transcript.vtt
    Downloading chat log...
      ✓ Saved: chat.txt
      ✓ Saved metadata.json

============================================================
[3/3] Processing: PQ Interop #15, Oct 29, 2025
  Meeting IDs: 899 1066 9821
  Date: Oct 29, 2025
  ⚠ No recording found

============================================================
Uploading 2 meeting folders to GitHub in single commit...
    Last commit SHA: c98f4456c643f9255a6febec87b6bc8957848ee4
    Base tree SHA: 32c22b1658dc76731cff2f3a5028ea024850e74f
    Creating tree with 6 files...
    New tree SHA: 8863e1d271739997afd6f8df2d9cc7b4602e7605
    New commit SHA: fc25593180e85355ef55826a573a736d9544787c
    ✓ Successfully uploaded 6 files in single commit
      Commit message: Add 6 transcript files from 2025-11-03 10:00
✓ Successfully uploaded 6 files in single commit

============================================================
=== SUMMARY ===
✓ Successfully processed: 2
⏭ Skipped (cached/exists): 0
⚠ No recording found: 1
⚠ Skipped short recordings: 0

Log saved to: logs/process_log_20251103_100005.txt
Unmatched issues saved to: logs/failed_matches_20251103_100005.json
Failed processing saved to: logs/failed_processing_20251103_100005.json
=== Processing meetings from last 1 days ===
Step 1: Fetching closed GitHub issues...
  Searching for issues closed after 2025-11-03
  Fetching page 1... got 100 issues
  Fetching page 2... got 100 issues
  Fetching page 3... got 100 issues
  Fetching page 4... got 100 issues
  Fetching page 5... got 100 issues
  Fetching page 6... got 100 issues
  Fetching page 7... got 100 issues
  Fetching page 8... got 100 issues
  Fetching page 9... got 100 issues
  Fetching page 10... got 100 issues
  Fetching page 11... got 100 issues
  Fetching page 12... got 100 issues
  Fetching page 13... got 100 issues
  Fetching page 14... got 100 issues
  Fetching page 15... got 100 issues
  Fetching page 16... got 100 issues
  Fetching page 17... got 86 issues
  Fetching page 18... got 0 issues
  No more issues found
  ✓ Found 2 closed issues in date range
  ✓ Found 0 matched meetings

No new meetings to upload

============================================================
=== SUMMARY ===
✓ Successfully processed: 0
⏭ Skipped (cached/exists): 0
⚠ No recording found: 0
⚠ Skipped short recordings: 0

Log saved to: logs/process_log_20251104_100005.txt
=== Processing meetings from last 1 days ===
Step 1: Fetching closed GitHub issues...
  Searching for issues closed after 2025-11-04
  Fetching page 1... got 100 issues
  Fetching page 2... got 100 issues
  Fetching page 3... got 100 issues
  Fetching page 4... got 100 issues
  Fetching page 5... got 100 issues
  Fetching page 6... got 100 issues
  Fetching page 7... got 100 issues
  Fetching page 8... got 100 issues
  Fetching page 9... got 100 issues
  Fetching page 10... got 100 issues
  Fetching page 11... got 100 issues
  Fetching page 12... got 100 issues
  Fetching page 13... got 100 issues
  Fetching page 14... got 100 issues
  Fetching page 15... got 100 issues
  Fetching page 16... got 100 issues
  Fetching page 17... got 91 issues
  Fetching page 18... got 0 issues
  No more issues found
  ✓ Found 5 closed issues in date range
  ✓ Found 4 matched meetings
  Saved 1 unmatched issues to logs/failed_matches_20251105_100004.json

============================================================
[1/4] Processing: EIP Editing Office Hour (EIP + ERC) Meeting #78, Nov 04, 2025
  Meeting IDs: 851 1464 8304
  Date: Nov 04, 2025
  Recording found: 58 minutes

  Downloading to: downloads/EIP-Editing-Office-Hour/Call-078_2025-11-04
    Downloading transcript...
      ✓ Saved: transcript.vtt
    Downloading chat log...
      ✓ Saved: chat.txt
      ✓ Saved metadata.json

============================================================
[2/4] Processing: FOCIL Breakout #23, November 4, 2025
  Meeting IDs: 842 6574 5580
  Date: November 4, 2025
  Recording found: 166 minutes

  Downloading to: downloads/FOCIL/Call-023_2025-11-04
    Downloading transcript...
      ✓ Saved: transcript.vtt
    Downloading chat log...
      ✓ Saved: chat.txt
      ✓ Saved metadata.json

============================================================
[3/4] Processing: PQ Interop #15 | Nov 5, 2025
  Meeting IDs: 899 1066 9821
  Date: Nov 5, 2025
  Recording found: 24 minutes

  Downloading to: downloads/PQ-Interop/Call-015_2025-11-05
    Downloading chat log...
      ✓ Saved: chat.txt
    Downloading transcript...
      ✓ Saved: transcript.vtt
      ✓ Saved metadata.json

============================================================
[4/4] Processing: All Core Devs - Testing (ACDT) #60, November 3, 2025
  Meeting IDs: 842 5123 7513, 884 7930 8162, 864 6616 9680
  Date: November 3, 2025
  Recording found: 47 minutes

  Downloading to: downloads/ACDT/Call-060_2025-11-03
    Downloading transcript...
      ✓ Saved: transcript.vtt
    Downloading chat log...
      ✓ Saved: chat.txt
      ✓ Saved metadata.json

============================================================
Uploading 4 meeting folders to GitHub in single commit...
    Last commit SHA: fc25593180e85355ef55826a573a736d9544787c
    Base tree SHA: 8863e1d271739997afd6f8df2d9cc7b4602e7605
    Creating tree with 12 files...
    New tree SHA: b9251fa02e740239244995ebb315f2da7e56716b
    New commit SHA: d15a0f42c1c360f343a20a145a89a11f3898668d
    ✓ Successfully uploaded 12 files in single commit
      Commit message: Add 12 transcript files from 2025-11-05 10:00
✓ Successfully uploaded 12 files in single commit

============================================================
=== SUMMARY ===
✓ Successfully processed: 4
⏭ Skipped (cached/exists): 0
⚠ No recording found: 0
⚠ Skipped short recordings: 0

Log saved to: logs/process_log_20251105_100004.txt
Unmatched issues saved to: logs/failed_matches_20251105_100004.json
=== Processing meetings from last 1 days ===
Step 1: Fetching closed GitHub issues...
  Searching for issues closed after 2025-11-05
  Fetching page 1... got 100 issues
  Fetching page 2... got 100 issues
  Fetching page 3... got 100 issues
  Fetching page 4... got 100 issues
  Fetching page 5... got 100 issues
  Fetching page 6... got 100 issues
  Fetching page 7... got 100 issues
  Fetching page 8... got 100 issues
  Fetching page 9... got 100 issues
  Fetching page 10... got 100 issues
  Fetching page 11... got 100 issues
  Fetching page 12... got 100 issues
  Fetching page 13... got 100 issues
  Fetching page 14... got 100 issues
  Fetching page 15... got 100 issues
  Fetching page 16... got 100 issues
  Fetching page 17... got 92 issues
  Fetching page 18... got 0 issues
  No more issues found
  ✓ Found 4 closed issues in date range
  ✓ Found 4 matched meetings

============================================================
[1/4] Processing: L2 Interop Working Group - Call #16 - November 5th, 2025
  Meeting IDs: 895 6907 7828
  Date: November 5, 2025
  Recording found: 73 minutes

  Downloading to: downloads/L2-Interop/Call-016_2025-11-05
    Downloading chat log...
      ✓ Saved: chat.txt
    Downloading transcript...
      ✓ Saved: transcript.vtt
      ✓ Saved metadata.json

============================================================
[2/4] Processing: EIP Editing Office Hour (EIP + ERC) Meeting #78, Nov 04, 2025
  ⏭ Already processed (cached)

============================================================
[3/4] Processing: FOCIL Breakout #23, November 4, 2025
  ⏭ Already processed (cached)

============================================================
[4/4] Processing: PQ Interop #15 | Nov 5, 2025
  ⏭ Already processed (cached)

============================================================
Uploading 1 meeting folders to GitHub in single commit...
    Last commit SHA: d15a0f42c1c360f343a20a145a89a11f3898668d
    Base tree SHA: b9251fa02e740239244995ebb315f2da7e56716b
    Creating tree with 3 files...
    New tree SHA: 36b788e92c6a46bcdccdedb37a324791af39ab37
    New commit SHA: 985c6d2a4ce08c2eb9961101d7e4aa38f784aefe
    ✓ Successfully uploaded 3 files in single commit
      Commit message: Add 3 transcript files from 2025-11-06 10:00
✓ Successfully uploaded 3 files in single commit

============================================================
=== SUMMARY ===
✓ Successfully processed: 1
⏭ Skipped (cached/exists): 3
⚠ No recording found: 0
⚠ Skipped short recordings: 0

Log saved to: logs/process_log_20251106_100005.txt
=== Processing meetings from last 1 days ===
Step 1: Fetching closed GitHub issues...
  Searching for issues closed after 2025-11-06
  Fetching page 1... got 100 issues
  Fetching page 2... got 100 issues
  Fetching page 3... got 100 issues
  Fetching page 4... got 100 issues
  Fetching page 5... got 100 issues
  Fetching page 6... got 100 issues
  Fetching page 7... got 100 issues
  Fetching page 8... got 100 issues
  Fetching page 9... got 100 issues
  Fetching page 10... got 100 issues
  Fetching page 11... got 100 issues
  Fetching page 12... got 100 issues
  Fetching page 13... got 100 issues
  Fetching page 14... got 100 issues
  Fetching page 15... got 100 issues
  Fetching page 16... got 100 issues
  Fetching page 17... got 96 issues
  Fetching page 18... got 0 issues
  No more issues found
  ✓ Found 4 closed issues in date range
  ✓ Found 0 matched meetings
  Saved 1 unmatched issues to logs/failed_matches_20251107_100005.json

No new meetings to upload

============================================================
=== SUMMARY ===
✓ Successfully processed: 0
⏭ Skipped (cached/exists): 0
⚠ No recording found: 0
⚠ Skipped short recordings: 0

Log saved to: logs/process_log_20251107_100005.txt
Unmatched issues saved to: logs/failed_matches_20251107_100005.json
=== Processing meetings from last 1 days ===
Step 1: Fetching closed GitHub issues...
  Searching for issues closed after 2025-11-07
  Fetching page 1... got 100 issues
  Fetching page 2... got 100 issues
  Fetching page 3... got 100 issues
  Fetching page 4... got 100 issues
  Fetching page 5... got 100 issues
  Fetching page 6... got 100 issues
  Fetching page 7... got 100 issues
  Fetching page 8... got 100 issues
  Fetching page 9... got 100 issues
  Fetching page 10... got 100 issues
  Fetching page 11... got 100 issues
  Fetching page 12... got 100 issues
  Fetching page 13... got 100 issues
  Fetching page 14... got 100 issues
  Fetching page 15... got 100 issues
  Fetching page 16... got 100 issues
  Fetching page 17... got 97 issues
  Fetching page 18... got 0 issues
  No more issues found
  ✓ Found 2 closed issues in date range
  ✓ Found 0 matched meetings
  Saved 2 unmatched issues to logs/failed_matches_20251108_100004.json

No new meetings to upload

============================================================
=== SUMMARY ===
✓ Successfully processed: 0
⏭ Skipped (cached/exists): 0
⚠ No recording found: 0
⚠ Skipped short recordings: 0

Log saved to: logs/process_log_20251108_100004.txt
Unmatched issues saved to: logs/failed_matches_20251108_100004.json
=== Processing meetings from last 1 days ===
Step 1: Fetching closed GitHub issues...
  Searching for issues closed after 2025-11-08
  Fetching page 1... got 100 issues
  Fetching page 2... got 100 issues
  Fetching page 3... got 100 issues
  Fetching page 4... got 100 issues
  Fetching page 5... got 100 issues
  Fetching page 6... got 100 issues
  Fetching page 7... got 100 issues
  Fetching page 8... got 100 issues
  Fetching page 9... got 100 issues
  Fetching page 10... got 100 issues
  Fetching page 11... got 100 issues
  Fetching page 12... got 100 issues
  Fetching page 13... got 100 issues
  Fetching page 14... got 100 issues
  Fetching page 15... got 100 issues
  Fetching page 16... got 100 issues
  Fetching page 17... got 100 issues
  Fetching page 18... got 2 issues
  Fetching page 19... got 0 issues
  No more issues found
  ✓ Found 5 closed issues in date range
  ✓ Found 1 matched meetings
  Saved 4 unmatched issues to logs/failed_matches_20251109_100004.json

============================================================
[1/1] Processing: EIP-7928 Breakout #6, Nov 5, 2025
  Meeting IDs: 889 0262 7473
  Date: Nov 5, 2025
  Recording found: 69 minutes

  Downloading to: downloads/BAL/Call-006_2025-11-05
    Downloading chat log...
      ✓ Saved: chat.txt
    Downloading transcript...
      ✓ Saved: transcript.vtt
      ✓ Saved metadata.json

============================================================
Uploading 1 meeting folders to GitHub in single commit...
    Last commit SHA: 985c6d2a4ce08c2eb9961101d7e4aa38f784aefe
    Base tree SHA: 36b788e92c6a46bcdccdedb37a324791af39ab37
    Creating tree with 3 files...
    New tree SHA: 0677621f806c43f1902e04186df0b9b25a8fc51f
    New commit SHA: 9ff6b51f5d3b8dbf8db9a3c8847ed3074c3990fa
    ✓ Successfully uploaded 3 files in single commit
      Commit message: Add 3 transcript files from 2025-11-09 10:00
✓ Successfully uploaded 3 files in single commit

============================================================
=== SUMMARY ===
✓ Successfully processed: 1
⏭ Skipped (cached/exists): 0
⚠ No recording found: 0
⚠ Skipped short recordings: 0

Log saved to: logs/process_log_20251109_100004.txt
Unmatched issues saved to: logs/failed_matches_20251109_100004.json
=== Processing meetings from last 1 days ===
Step 1: Fetching closed GitHub issues...
  Searching for issues closed after 2025-11-09
  Fetching page 1... got 100 issues
  Fetching page 2... got 100 issues
  Fetching page 3... got 100 issues
  Fetching page 4... got 100 issues
  Fetching page 5... got 100 issues
  Fetching page 6... got 100 issues
  Fetching page 7... got 100 issues
  Fetching page 8... got 100 issues
  Fetching page 9... got 100 issues
  Fetching page 10... got 100 issues
  Fetching page 11... got 100 issues
  Fetching page 12... got 100 issues
  Fetching page 13... got 100 issues
  Fetching page 14... got 100 issues
  Fetching page 15... got 100 issues
  Fetching page 16... got 100 issues
  Fetching page 17... got 100 issues
  Fetching page 18... got 2 issues
  Fetching page 19... got 0 issues
  No more issues found
  ✓ Found 5 closed issues in date range
  ✓ Found 1 matched meetings
  Saved 4 unmatched issues to logs/failed_matches_20251110_100004.json

============================================================
[1/1] Processing: EIP-7928 Breakout #6, Nov 5, 2025
  ⏭ Already processed (cached)

No new meetings to upload

============================================================
=== SUMMARY ===
✓ Successfully processed: 0
⏭ Skipped (cached/exists): 1
⚠ No recording found: 0
⚠ Skipped short recordings: 0

Log saved to: logs/process_log_20251110_100004.txt
Unmatched issues saved to: logs/failed_matches_20251110_100004.json
=== Processing meetings from last 1 days ===
Step 1: Fetching closed GitHub issues...
  Searching for issues closed after 2025-11-10
  Fetching page 1... got 100 issues
  Fetching page 2... got 100 issues
  Fetching page 3... got 100 issues
  Fetching page 4... got 100 issues
  Fetching page 5... got 100 issues
  Fetching page 6... got 100 issues
  Fetching page 7... got 100 issues
  Fetching page 8... got 100 issues
  Fetching page 9... got 100 issues
  Fetching page 10... got 100 issues
  Fetching page 11... got 100 issues
  Fetching page 12... got 100 issues
  Fetching page 13... got 100 issues
  Fetching page 14... got 100 issues
  Fetching page 15... got 100 issues
  Fetching page 16... got 100 issues
  Fetching page 17... got 100 issues
  Fetching page 18... got 3 issues
  Fetching page 19... got 0 issues
  No more issues found
  ✓ Found 1 closed issues in date range
  ✓ Found 1 matched meetings

============================================================
[1/1] Processing: All Core Devs - Execution (ACDE) #224, November 6, 2025
  Meeting IDs: 854 5172 3466, 882 6983 6469, 913 4859 2283, 875 9142 7897
  Date: November 6, 2025
  Recording found: 94 minutes

  Downloading to: downloads/ACDE/Call-224_2025-11-06
    Downloading transcript...
      ✓ Saved: transcript.vtt
    Downloading chat log...
      ✓ Saved: chat.txt
      ✓ Saved metadata.json

============================================================
Uploading 1 meeting folders to GitHub in single commit...
    Last commit SHA: 9ff6b51f5d3b8dbf8db9a3c8847ed3074c3990fa
    Base tree SHA: 0677621f806c43f1902e04186df0b9b25a8fc51f
    Creating tree with 3 files...
    New tree SHA: f81c918eec902b52b9d2ecbe4db770c842eaed66
    New commit SHA: 54ec752952f9a02a32668047d2685ff69a458e83
    ✓ Successfully uploaded 3 files in single commit
      Commit message: Add 3 transcript files from 2025-11-11 10:00
✓ Successfully uploaded 3 files in single commit

============================================================
=== SUMMARY ===
✓ Successfully processed: 1
⏭ Skipped (cached/exists): 0
⚠ No recording found: 0
⚠ Skipped short recordings: 0

Log saved to: logs/process_log_20251111_100002.txt
=== Processing meetings from last 1 days ===
Step 1: Fetching closed GitHub issues...
  Searching for issues closed after 2025-11-11
  Fetching page 1... got 100 issues
  Fetching page 2... got 100 issues
  Fetching page 3... got 100 issues
  Fetching page 4... got 100 issues
  Fetching page 5... got 100 issues
  Fetching page 6... got 100 issues
  Fetching page 7... got 100 issues
  Fetching page 8... got 100 issues
  Fetching page 9... got 100 issues
  Fetching page 10... got 100 issues
  Fetching page 11... got 100 issues
  Fetching page 12... got 100 issues
  Fetching page 13... got 100 issues
  Fetching page 14... got 100 issues
  Fetching page 15... got 100 issues
  Fetching page 16... got 100 issues
  Fetching page 17... got 100 issues
  Fetching page 18... got 3 issues
  Fetching page 19... got 0 issues
  No more issues found
  ✓ Found 0 closed issues in date range
  ✓ Found 0 matched meetings

No new meetings to upload

============================================================
=== SUMMARY ===
✓ Successfully processed: 0
⏭ Skipped (cached/exists): 0
⚠ No recording found: 0
⚠ Skipped short recordings: 0

Log saved to: logs/process_log_20251112_100003.txt
=== Processing meetings from last 1 days ===
Traceback (most recent call last):
  File "/Users/nixorokish/Documents/VScode/transcripts-to-github/venv/lib/python3.13/site-packages/urllib3/connection.py", line 198, in _new_conn
    sock = connection.create_connection(
        (self._dns_host, self.port),
    ...<2 lines>...
        socket_options=self.socket_options,
    )
  File "/Users/nixorokish/Documents/VScode/transcripts-to-github/venv/lib/python3.13/site-packages/urllib3/util/connection.py", line 60, in create_connection
    for res in socket.getaddrinfo(host, port, family, socket.SOCK_STREAM):
               ~~~~~~~~~~~~~~~~~~^^^^^^^^^^^^^^^^^^^^^^^^^^^^^^^^^^^^^^^^
  File "/opt/homebrew/Cellar/python@3.13/3.13.3/Frameworks/Python.framework/Versions/3.13/lib/python3.13/socket.py", line 977, in getaddrinfo
    for res in _socket.getaddrinfo(host, port, family, type, proto, flags):
               ~~~~~~~~~~~~~~~~~~~^^^^^^^^^^^^^^^^^^^^^^^^^^^^^^^^^^^^^^^^
socket.gaierror: [Errno 8] nodename nor servname provided, or not known

The above exception was the direct cause of the following exception:

Traceback (most recent call last):
  File "/Users/nixorokish/Documents/VScode/transcripts-to-github/venv/lib/python3.13/site-packages/urllib3/connectionpool.py", line 787, in urlopen
    response = self._make_request(
        conn,
    ...<10 lines>...
        **response_kw,
    )
  File "/Users/nixorokish/Documents/VScode/transcripts-to-github/venv/lib/python3.13/site-packages/urllib3/connectionpool.py", line 488, in _make_request
    raise new_e
  File "/Users/nixorokish/Documents/VScode/transcripts-to-github/venv/lib/python3.13/site-packages/urllib3/connectionpool.py", line 464, in _make_request
    self._validate_conn(conn)
    ~~~~~~~~~~~~~~~~~~~^^^^^^
  File "/Users/nixorokish/Documents/VScode/transcripts-to-github/venv/lib/python3.13/site-packages/urllib3/connectionpool.py", line 1093, in _validate_conn
    conn.connect()
    ~~~~~~~~~~~~^^
  File "/Users/nixorokish/Documents/VScode/transcripts-to-github/venv/lib/python3.13/site-packages/urllib3/connection.py", line 753, in connect
    self.sock = sock = self._new_conn()
                       ~~~~~~~~~~~~~~^^
  File "/Users/nixorokish/Documents/VScode/transcripts-to-github/venv/lib/python3.13/site-packages/urllib3/connection.py", line 205, in _new_conn
    raise NameResolutionError(self.host, self, e) from e
urllib3.exceptions.NameResolutionError: <urllib3.connection.HTTPSConnection object at 0x10652d160>: Failed to resolve 'zoom.us' ([Errno 8] nodename nor servname provided, or not known)

The above exception was the direct cause of the following exception:

Traceback (most recent call last):
  File "/Users/nixorokish/Documents/VScode/transcripts-to-github/venv/lib/python3.13/site-packages/requests/adapters.py", line 644, in send
    resp = conn.urlopen(
        method=request.method,
    ...<9 lines>...
        chunked=chunked,
    )
  File "/Users/nixorokish/Documents/VScode/transcripts-to-github/venv/lib/python3.13/site-packages/urllib3/connectionpool.py", line 841, in urlopen
    retries = retries.increment(
        method, url, error=new_e, _pool=self, _stacktrace=sys.exc_info()[2]
    )
  File "/Users/nixorokish/Documents/VScode/transcripts-to-github/venv/lib/python3.13/site-packages/urllib3/util/retry.py", line 519, in increment
    raise MaxRetryError(_pool, url, reason) from reason  # type: ignore[arg-type]
    ^^^^^^^^^^^^^^^^^^^^^^^^^^^^^^^^^^^^^^^^^^^^^^^^^^^
urllib3.exceptions.MaxRetryError: HTTPSConnectionPool(host='zoom.us', port=443): Max retries exceeded with url: /oauth/token (Caused by NameResolutionError("<urllib3.connection.HTTPSConnection object at 0x10652d160>: Failed to resolve 'zoom.us' ([Errno 8] nodename nor servname provided, or not known)"))

During handling of the above exception, another exception occurred:

Traceback (most recent call last):
  File "/Users/nixorokish/Documents/VScode/transcripts-to-github/main.py", line 299, in <module>
    process_recent_meetings(days_back=days)
    ~~~~~~~~~~~~~~~~~~~~~~~^^^^^^^^^^^^^^^^
  File "/Users/nixorokish/Documents/VScode/transcripts-to-github/main.py", line 79, in process_recent_meetings
    zoom_token = get_zoom_access_token()
  File "/Users/nixorokish/Documents/VScode/transcripts-to-github/zoom_fetcher.py", line 41, in get_zoom_access_token
    response = requests.post(url, headers=headers, data=data)
  File "/Users/nixorokish/Documents/VScode/transcripts-to-github/venv/lib/python3.13/site-packages/requests/api.py", line 115, in post
    return request("post", url, data=data, json=json, **kwargs)
  File "/Users/nixorokish/Documents/VScode/transcripts-to-github/venv/lib/python3.13/site-packages/requests/api.py", line 59, in request
    return session.request(method=method, url=url, **kwargs)
           ~~~~~~~~~~~~~~~^^^^^^^^^^^^^^^^^^^^^^^^^^^^^^^^^^
  File "/Users/nixorokish/Documents/VScode/transcripts-to-github/venv/lib/python3.13/site-packages/requests/sessions.py", line 589, in request
    resp = self.send(prep, **send_kwargs)
  File "/Users/nixorokish/Documents/VScode/transcripts-to-github/venv/lib/python3.13/site-packages/requests/sessions.py", line 703, in send
    r = adapter.send(request, **kwargs)
  File "/Users/nixorokish/Documents/VScode/transcripts-to-github/venv/lib/python3.13/site-packages/requests/adapters.py", line 677, in send
    raise ConnectionError(e, request=request)
requests.exceptions.ConnectionError: HTTPSConnectionPool(host='zoom.us', port=443): Max retries exceeded with url: /oauth/token (Caused by NameResolutionError("<urllib3.connection.HTTPSConnection object at 0x10652d160>: Failed to resolve 'zoom.us' ([Errno 8] nodename nor servname provided, or not known)"))
=== Processing meetings from last 1 days ===
Step 1: Fetching closed GitHub issues...
  Searching for issues closed after 2025-11-25
  Fetching page 1... got 100 issues
  Fetching page 2... got 100 issues
  Fetching page 3... got 100 issues
  Fetching page 4... got 100 issues
  Fetching page 5... got 100 issues
  Fetching page 6... got 100 issues
  Fetching page 7... got 100 issues
  Fetching page 8... got 100 issues
  Fetching page 9... got 100 issues
  Fetching page 10... got 100 issues
  Fetching page 11... got 100 issues
  Fetching page 12... got 100 issues
  Fetching page 13... got 100 issues
  Fetching page 14... got 100 issues
  Fetching page 15... got 100 issues
  Fetching page 16... got 100 issues
  Fetching page 17... got 100 issues
  Fetching page 18... got 9 issues
  Fetching page 19... got 0 issues
  No more issues found
  ✓ Found 0 closed issues in date range
  ✓ Found 0 matched meetings

No new meetings to upload

============================================================
=== SUMMARY ===
✓ Successfully processed: 0
⏭ Skipped (cached/exists): 0
⚠ No recording found: 0
⚠ Skipped short recordings: 0

Log saved to: logs/process_log_20251126_100005.txt
=== Processing meetings from last 1 days ===
Step 1: Fetching closed GitHub issues...
  Searching for issues closed after 2025-11-26
  Fetching page 1... got 100 issues
  Fetching page 2... got 100 issues
  Fetching page 3... got 100 issues
  Fetching page 4... got 100 issues
  Fetching page 5... got 100 issues
  Fetching page 6... got 100 issues
  Fetching page 7... got 100 issues
  Fetching page 8... got 100 issues
  Fetching page 9... got 100 issues
  Fetching page 10... got 100 issues
  Fetching page 11... got 100 issues
  Fetching page 12... got 100 issues
  Fetching page 13... got 100 issues
  Fetching page 14... got 100 issues
  Fetching page 15... got 100 issues
  Fetching page 16... got 100 issues
  Fetching page 17... got 100 issues
  Fetching page 18... got 18 issues
  Fetching page 19... got 0 issues
  No more issues found
  ✓ Found 9 closed issues in date range
  ✓ Found 2 matched meetings

============================================================
[1/2] Processing: EIP-7928 Breakout #7, Nov 19, 2025
  Meeting IDs: 889 0262 7473
  Date: Nov 19, 2025
  Recording found: 259 minutes

  Downloading to: downloads/BAL/Call-007_2025-11-19
    Downloading chat log...
      ✓ Saved: chat.txt
    Downloading transcript...
      ✓ Saved: transcript.vtt
      ✓ Saved metadata.json

============================================================
[2/2] Processing: AllWalletDevs, call #36, November 26, 2025
  ⏭ Already processed (cached)

============================================================
Uploading 1 meeting folders to GitHub in single commit...
    Last commit SHA: 8674e7c0deab0cb89c9aad7fec2100cfa864a18f
    Base tree SHA: fc8f446ad1a4485b9ccb786caede0ca853954356
    Creating tree with 3 files...
    New tree SHA: 56ad42bfbd07233afd4f1696d586975ac3d37c27
    New commit SHA: 54a8cc88c0d30bf3ed3f74129f99be81f0e6b59e
    ✓ Successfully uploaded 3 files in single commit
      Commit message: Add 3 transcript files from 2025-11-27 10:00
✓ Successfully uploaded 3 files in single commit

============================================================
=== SUMMARY ===
✓ Successfully processed: 1
⏭ Skipped (cached/exists): 1
⚠ No recording found: 0
⚠ Skipped short recordings: 0

Log saved to: logs/process_log_20251127_100005.txt
